{
  "$schema": "../schemas/collections/cost-inputs.schema.json",
  "schema_version": "3.0.0",
  "artemis_budget_inputs": {
    "launch_date": "1980-05-19",
    "basis": "Author-requested budget range from NCC 1980 onward. Costs are engineering allowances, not supplier quotations. No historical IBM-PC competition is assumed before 1982.",
    "base_cost_snapshots": {
      "1978": {
        "status": "not_yet_offered",
        "total_usd": null
      },
      "1979": {
        "status": "not_yet_offered",
        "total_usd": null
      },
      "1980": {
        "status": "offered_estimate",
        "total_usd": 1381.34,
        "low_usd": 966.94,
        "high_usd": 2210.14,
        "breakdown_usd": {
          "bom_materials": 1067.4,
          "workforce": 100.2,
          "energy": 8.8,
          "consumables": 27.03,
          "operating_overhead": 25.09,
          "yield_and_rework": 49.79,
          "instructions": 9.6,
          "packaging": 21.6,
          "logistics": 28.8,
          "recurring_licenses": 0.0,
          "included_service_delivery": 43.03
        },
        "bom_assembly_ref": "assembly.bundle.artemis_128_color",
        "bom_lines": [
          {
            "component_ref": "part.bundle.artemis_128_color.bundle_cables_media_manuals_and_carton_packout",
            "quantity": 1,
            "extended_recurring_cost_usd": 0
          },
          {
            "component_ref": "part.computer.artemis.525_inch_double_density_floppy_mechanism",
            "quantity": 2,
            "extended_recurring_cost_usd": 225.0
          },
          {
            "component_ref": "part.computer.artemis.boot_rom_chips",
            "quantity": 1,
            "extended_recurring_cost_usd": 7.2
          },
          {
            "component_ref": "part.computer.artemis.clock_reset_interrupts_mapper_and_bus_buffers",
            "quantity": 1,
            "extended_recurring_cost_usd": 16.2
          },
          {
            "component_ref": "part.computer.artemis.connectors_passives_fasteners_and_harnesses",
            "quantity": 1,
            "extended_recurring_cost_usd": 36.72
          },
          {
            "component_ref": "part.computer.artemis.enclosure_and_chassis",
            "quantity": 1,
            "extended_recurring_cost_usd": 48.96
          },
          {
            "component_ref": "part.computer.artemis.mainboard_pcb",
            "quantity": 1,
            "extended_recurring_cost_usd": 30.6
          },
          {
            "component_ref": "part.computer.artemis.paired_bank_dram_controller_refresh_and_data_buffers",
            "quantity": 1,
            "extended_recurring_cost_usd": 21.6
          },
          {
            "component_ref": "part.computer.artemis.psu",
            "quantity": 1,
            "extended_recurring_cost_usd": 57.12
          },
          {
            "component_ref": "part.device.artemis_video_card.artemis_video_card_pcb",
            "quantity": 1,
            "extended_recurring_cost_usd": 10.8
          },
          {
            "component_ref": "part.device.artemis_video_card.artemis_video_clock_transceivers",
            "quantity": 1,
            "extended_recurring_cost_usd": 12.0
          },
          {
            "component_ref": "part.device.artemis_video_card.artemis_video_host_interface",
            "quantity": 1,
            "extended_recurring_cost_usd": 10.8
          },
          {
            "component_ref": "part.device.artemis_video_card.artemis_video_slot_connector",
            "quantity": 1,
            "extended_recurring_cost_usd": 9.6
          },
          {
            "component_ref": "part.device.artemis_video_card_16kb.economy_video_byte_bridge",
            "quantity": 1,
            "extended_recurring_cost_usd": 7.8
          },
          {
            "component_ref": "part.device.color_monitor_2.external_cable_and_regional_mains_packout",
            "quantity": 1,
            "extended_recurring_cost_usd": 2.4
          },
          {
            "component_ref": "part.device.color_monitor_2.hv_deflection_and_psu_not_included_by_oem",
            "quantity": 1,
            "extended_recurring_cost_usd": 0
          },
          {
            "component_ref": "part.device.color_monitor_2.monitor_enclosure",
            "quantity": 1,
            "extended_recurring_cost_usd": 21.6
          },
          {
            "component_ref": "part.device.color_monitor_2.passives_protection_and_internal_harnesses",
            "quantity": 1,
            "extended_recurring_cost_usd": 4.8
          },
          {
            "component_ref": "part.device.color_monitor_2.video_receiver_and_rgb_amplifiers",
            "quantity": 1,
            "extended_recurring_cost_usd": 15.6
          },
          {
            "component_ref": "part.device.flexibus_keyboard.external_cable_and_regional_mains_packout",
            "quantity": 1,
            "extended_recurring_cost_usd": 2.4
          },
          {
            "component_ref": "part.device.flexibus_keyboard.flexibus_interface_electronics",
            "quantity": 1,
            "extended_recurring_cost_usd": 6.0
          },
          {
            "component_ref": "part.device.flexibus_keyboard.key_switches",
            "quantity": 1,
            "extended_recurring_cost_usd": 21.6
          },
          {
            "component_ref": "part.device.flexibus_keyboard.keyboard_cable",
            "quantity": 1,
            "extended_recurring_cost_usd": 2.4
          },
          {
            "component_ref": "part.device.flexibus_keyboard.keyboard_enclosure",
            "quantity": 1,
            "extended_recurring_cost_usd": 7.2
          },
          {
            "component_ref": "part.device.flexibus_keyboard.keyboard_pcb",
            "quantity": 1,
            "extended_recurring_cost_usd": 3.6
          },
          {
            "component_ref": "part.device.flexibus_keyboard.keycaps",
            "quantity": 1,
            "extended_recurring_cost_usd": 6.0
          },
          {
            "component_ref": "part.device.flexibus_keyboard.matrix_diodes",
            "quantity": 1,
            "extended_recurring_cost_usd": 1.8
          },
          {
            "component_ref": "part.device.flexibus_keyboard.passives_protection_and_internal_harnesses",
            "quantity": 1,
            "extended_recurring_cost_usd": 4.8
          },
          {
            "component_ref": "part.device.flexibus_keyboard.scan_controller_and_firmware_storage",
            "quantity": 1,
            "extended_recurring_cost_usd": 3.6
          },
          {
            "component_ref": "part.aion_2114",
            "quantity": 2,
            "extended_recurring_cost_usd": 7.52
          },
          {
            "component_ref": "part.aion_4116",
            "quantity": 8,
            "extended_recurring_cost_usd": 26.97
          },
          {
            "component_ref": "part.artemis_dma",
            "quantity": 1,
            "extended_recurring_cost_usd": 4.26
          },
          {
            "component_ref": "part.artemis_fdd_hdd_controller",
            "quantity": 1,
            "extended_recurring_cost_usd": 5.38
          },
          {
            "component_ref": "part.artemis_mmu",
            "quantity": 1,
            "extended_recurring_cost_usd": 11.24
          },
          {
            "component_ref": "part.artemis_ram_module_32kb_x16.capacity_identification_straps",
            "quantity": 4,
            "extended_recurring_cost_usd": 0.72
          },
          {
            "component_ref": "part.artemis_ram_module_32kb_x16.data_buffers_and_byte_enable_logic",
            "quantity": 4,
            "extended_recurring_cost_usd": 14.4
          },
          {
            "component_ref": "part.artemis_ram_module_32kb_x16.decoupling_and_bulk_capacitors",
            "quantity": 4,
            "extended_recurring_cost_usd": 4.8
          },
          {
            "component_ref": "part.artemis_ram_module_32kb_x16.module_connector_contacts",
            "quantity": 4,
            "extended_recurring_cost_usd": 9.6
          },
          {
            "component_ref": "part.artemis_ram_module_32kb_x16.module_pcb",
            "quantity": 4,
            "extended_recurring_cost_usd": 10.8
          },
          {
            "component_ref": "part.aurelia_video_chip",
            "quantity": 1,
            "extended_recurring_cost_usd": 17.21
          },
          {
            "component_ref": "part.color_monitor_controller",
            "quantity": 1,
            "extended_recurring_cost_usd": 2.69
          },
          {
            "component_ref": "part.dram_16kbit",
            "quantity": 64,
            "extended_recurring_cost_usd": 208.0
          },
          {
            "component_ref": "part.era1",
            "quantity": 1,
            "extended_recurring_cost_usd": 27.91
          },
          {
            "component_ref": "part.flexibus_host_controller",
            "quantity": 1,
            "extended_recurring_cost_usd": 2.39
          },
          {
            "component_ref": "part.medium_resolution_rgb_crt",
            "quantity": 1,
            "extended_recurring_cost_usd": 170
          },
          {
            "component_ref": "part.software.aionix.cartridge_pcb_and_connector_if_cartridge_delivered",
            "quantity": 1,
            "extended_recurring_cost_usd": 2.7
          },
          {
            "component_ref": "part.software.aionix.cartridge_shell_label_and_instructions",
            "quantity": 1,
            "extended_recurring_cost_usd": 2.4
          },
          {
            "component_ref": "part.software.aionix.rom_eprom_eeprom_or_media_selection",
            "quantity": 1,
            "extended_recurring_cost_usd": 15.48
          }
        ],
        "confidence": "low",